Name,Stars,Title,Date,Description
corey,4,Main title needs more info,N/A,sure the chip works beautifully but I had no idea the k series didn‚Äôt come with a cooler which is very upsetting for the price point. I now realize very small at the bottom of description it says no thermal cooling. Wish it said that in the main details
Steve D.,4,FAST,N/A,"fast cpu, did not come with a cpu cooler. Make sure you get agood cpu cooler if you play games!!! This cpu runs very HOTif you max it out. Recommend water cooler or LARGE air cooled."
Craigc,4,Screaming fast processor that runs really hot.,N/A,"I got this for a new system build even though a little higher than I like to spend. But it has performed great.After, I noticed a drop in performance and doing research, I found out that these run very very hot and the thermal protection had kicked in to throttle the processor down. I tried a few Air cooled options that did the trick, but they were too loud for me, so I ended up with a Liquid cooled option which is what I would recommend to anyone using this processor. Currently, my idle temps are around 41c and at 100% utilization, temps average around 60-70 with a quick peak of 95. I dont personally like to overclock for my own reasons, but I did do some overclocking on this for testing and everything worked great with what I did. 13th Gen blows away 12th gen. This I7 even bests the i9 12th gen. Great chip as long as you keep it cool."
Al-Mothafar Al-Hasan,4,Best CPU for gaming with this value,N/A,"If you are looking to get the best gaming experience with the decent price and not getting poor processing power, this is your option, you get the flagship power with lower price than competitor.It is usually huge amount of power however in load, but for person like me keeping OC most of the time, this is where E cores getting into the play.I'm not Intel fan anymore, I wanted to get AMD but because AMD requires DDR5 and much expensive for no payback compared to Intel, I did choose this, and I'm not regretting it.So TL;DR: if you are short in budget, and want something last long for next years, get this one fore sure."
GOKUL,4,Product is great. Delivery was a let down,N/A,Product is great. Delivery was a let down.
Michael Atamian,4,Runs hot,N/A,"Upgraded from Asus Prime Z390-A (i7 9700k) to Asus ROG Strix Z790-1 Wifi D4 (i7 13700k). Using Noctua NH-U12A air cooler. Temperatures around 60 C when gaming, with spikes around 75 C. Most users report this processor tends to run hot. I have not stress tested but have heard reports of throttling when under extreme (not typical user) load. Overall happy with the choice."
ron stoudt,4,works great,N/A,good intel cpu but overpriced. good graphics with intel 770 uhd.
PhotoKing,4,works,N/A,"I don't know how you rate a chipset, its the middle of the tier in speed, more cores would probably be better, but not many programs use all the cores. And I don't play games so I couldn't tell you how well it really does there."
DwonaldDwuck,4,Great cpu wish efficiency cores were more controllable,N/A,"Great cpu, however I wish I could customize when efficiency cores would be used for certain apps or services.  For example  a hypervisor.  Or Plex for 4k encoding ( want only physical cores for that)"
Dan,4,Great CPU but runs hot,N/A,"It's a great CPU. There are a bunch of great benchmarks out there to show how good it is, but it does run a bit hot. Make sure you get an excellent cooler for it."
Kevin Nguyen,4,Do not buy used looks like it‚Äôs been burnt,N/A,Ok my used product did work but Amazon says it‚Äôs Ike new but it isn‚Äôt Ike news. Good cpu for brand new
Tayler Powers,4,Solid,N/A,Had no problem out of it
Elhassani Mora Mohammed Reda,4,Livraison nulle,N/A,"Hi, Everything is good in the©condition of the packages, but the delivery is mediocre."
io,4,Fa quel che deve,N/A, It's performant but it gets hot and fast when it is loaded to work. Used for video and photo editing 
Hicham Spooky,4,Good value for 4070 tier GPUS,N/A,"Make sure to put it with a decent cooler and a mount plate for good surface pressure, also OC is decent also and could make it better, but amd 3D cache processors are fare ahead right now. For the price if you have an Intel motherboard already then it's a good choice"
J,4,Quick,N/A,This blisters through alot of the tasks it's put up to just draws alot of power and runs hot
Andr√©s,4,Excesiva temperatura,N/A,"
Although it is a great processor and despite having liquid cooling, it does not drop below 38 degrees at rest (core load below 1-2%). In games with Battlefield 2042 with medium and 2100x1400 confinement, all cores at 90 degrees. Before you had an i7 8700K and its temperatures were much lower.
"
Species,4,Multi t√¢ches,N/A,You©don't need a my cooler like a big noctua or a watercooling to have its full potential but pay attention to the value of your motherboard (PL1: 125w; PL2: 253; iccmax: 407 A )
Tiziana Cence,4,Intel i7 13700kf,N/A,"Intel i7 13700kf lga1700 processor. On the processor there is not much to say, it is perfect for gaming and for graphics, better there is only the 13th generation Intel/Ryzen 9 series. The processor is kf, that is, without integrated graphics card, so if you attach the hdmi to the motherboard it will not give signals and will be attached to the video card, I recommend no less than a 4070 or a 7800xt. I expected a much higher packaging than the poor cardboard support, but in the end it avoids shocks so it's fine. Inside the package we find the instructions and the iconic sticker Intel.Il processor heats up quite a bit but a liquid cooler of at least 240 is fine. A well-made air cooler will also do. The price is high but justified if we consider that according to benchmarks it is better than a last generation i9. Highly recommended."
Armando,4,Potente ma √® un fornetto,N/A,good
Michael,4,Caro ma ottimo per produttivita' e giochi,N/A,"For many an i5 might be enough, but if you do some video rendering or photo processing or play with a lot of background software (streams, etc.) this i7 is a great cost-performance ratio compared to the top of the range i9."
Adrianski,4,Sembra ottima,N/A,"I've been using this cpu for a while, not bad. Excellent, but it really heats up a lot. "
Filipe,4,O produto n√£o √© novo,N/A," I was almost to give it back, however after reflecting I will mount to assemble my build, if it works correctly I will keep it."
Bramerit17,4,Performance impressionnante,N/A,"It meets my expectations in terms of gaming, but see©a good cooling system because it heats up, even with my watercoling, it climbs to 85-90'c at the max"
Omar Tiraboschi,4,Fenomenale,N/A,Spectacular!
Jacob A.,5,Can‚Äôt be beat!,N/A,Except the i9! Beautifully powerful processor. Very happy with it.
"Great product, 5/5",5,Runs like a beast.,N/A,I Only use my pc for hardcore flight simming (commercial operations in airlines) in Microsoft flight sim. It‚Äôs one of the most demanding things ever but this cpu brought me from 40 fps on the 12400f to 50-60 fps with this new 13700k. Love it.
Diego,5,Funciona muy bien,N/A,The processor arrived without any problems and without damage ±to the packaging. It has worked very well for me for overclocking
joe,5,Works Like a Champ !,N/A,"Bought it for $373 on Prime Day, two days later it dropped to $364.99 (14700k came out). That's the only complain I could have."
William Rodr√≠guez B.,5,R√°pido y muy bueno,N/A,Excellent for the price
Corey Palmer,5,Must have 2023,N/A,"Excellent processor for the price, can‚Äôt really beat it in 2022-2023. In comparison to the i9, there really doesn‚Äôt seem to be much difference (comparing my set up with this i7 to my friends with an i9). I did get mine on sale, but I would have happily paid full price"
Apes_Vs_Grapes,5,Great for those that want to do more,N/A,"Intel's 13th gen is a very strong contender and the i7 this time around is all the overkill I needed. While the i5 works great for gaming the extra cores in the i7 make it even better for game streaming or production workloads like video editing, It can be a little power hungry but uses that power to overclock extremely well, but thanks to the efficiency cores when you are sitting idle runs with very low power."
GG,5,GG,N/A,"The first time I see, the PC faster, than me.For the cooling I am using the -DeepCool GAMMAXX AG620 WH ARGB,which is the BEST solution for this processor and is not very expensive!"
Jason,5,"It is what it is, works as intended",N/A,"Not a lot to review, it does as it was intended to do, and I have no complains (except they released the next gen, not even a week after I bought it. )"
Lawrence D. Schultz,5,Arrived on time,N/A,Excellent processor.
Alura,5,Intel jamais d√©√ßu,N/A,"Perfect for gaming, no need to upgrade to I-9 for the moment or a newer "
Sandro B√∂hme,5,Intel for the win.,N/A,"Great CPU. Easily withstands gaming and workstation workloads, while also running air-cooled at its full Turbo clock. It even beats all its predecessors"
Andrei Cusnir,5,Work as it shoud.,N/A,Work as it shoud.
Davide G.,5,Una bestia molto versatile,N/A,the product is remarkable
Hodei,5,Procesador todoterreno,N/A,"This processor can handle anything. I do both video editing and photography editing and it flies, nothing resists it with 16 cores"
Hugo,5,Surpris,N/A,"Being still on AMD, I decided©to change to take an i7 and frankly WOW, the very powerful and versatile processor, the only ""soft©"" thing is that it goes up quickly in temperature©. "
Brodus,5,CPU eccezionale,N/A,"You can indulge yourself with this cpu, brought to 5.8ghz the pcores and 4.5 the cores in oc but touching in cb23 385watts of consumption which are absolutely not few, or bringing it to 1.18v without altering anything else it is very stable and not pass the 250watts but these are benchmark figures and nothing else, in daily use that is gaming otherwise what else to buy it for "
Sergio,5,"Es el mejor procesador actualmente, sin dejarte un dineral sin sentido",N/A,"It is the best processor you can currently buy, good-nice-cheap, and that it is high-end. "
uTired2,5,It's good,N/A,"Can now run recent games at more than 10fps, yay!"
Nobody,5,Richtig Leistung aber Achtung Hei√ü.,N/A,Top CPU richtig Leistung aber war ja auch eigentlich klar.Allerdings muss ich erw√§hnen die CPU Wird sehr hei√ü unter Last also eine Wasserk√ºhlung ist eigentlich Pflicht meiner Meinung nach üëç
Mandiaux P.,5,ok,N/A,good
Mehdy,5,Top !!!,N/A,"I improved©© my setup by replacing my i9-9900Kf with the i7-13700KF, which I paired© with a Gigabyte Z790 Elite motherboard. For the cooling system,"
Hayden,5,Best option for a ¬£1200 gaming pc,N/A,Does the job!
Best Yasuo EU,5,buen precio y calidad,N/A,It goes super fast with Genshin Impact and LOL games
Ciccone,5,Intel Core i7-13700KF: Perfekte Preis-Leistung f√ºr erstklassige Performance!,N/A,very good
Giacomo,5,super,N/A,i7 very fast
Leon,5,Sehr gute CPU,N/A,This CPU is the perfect combo 
Paul33,5,Excellent processeur Gamer,N/A,"Excellent processor for gamers, very good value© for money. Recommended"
Jorge,5,Perfecto,N/A,"Everything arrived super well, without problems and fast, the best processor, good temperatures and it is not left behind in anything"
Christian M.,5,A Beast that doesnt need an arc reactor to run,N/A,"Of the 13 gen Intel CPUs I feel like this is the best, its faster than the i5 13600K and far cheaper than the i9 13900k. Yes the 13900K is faster, "
Franck Lejeau,5,Le must toujours Intel je prends m√™me si je dois attendre pour l'achet√© !,N/A,"Nothing to say powerful, super stable, fast, secure©©: there will always be little things probably less than other brands. So my favorite©©©brand for CPUs."
Felix,5,Super CPU aber schwer zu k√ºhlen,N/A,"Performance is really top. However, the heat development (and power consumption) are also quite high"
Andrea Gumirato,5,Ottimo prodotto - Intel una garanzia,N/A,"Excellent product, a lot of power under the hood with many cores, which in this architecture are divided between Performance and Efficient."
PC Mike,5,i7-13700KF CPU,N/A,"Made the step up to 13 Gen platform from 11 Gen. Have to say that I am happy with my decision. I do a lot of video editing and many of my files are large, so my rendering time has improved. Obviously it not just the CPU but the whole of my configuration. I'm just saying the upgrade and this CPU has helped."
rafa,5,Todo perfecto,N/A,Everything very well I like it a lot
kirimandarine,5,nickel,N/A,"what more can I say... Oh yes, he looks strong, the beast... "
Giovanna,5,Best buy nel 2023,N/A,The best CPU (without spending a fortune) in April 2023. Great for my workstation and gaming!
Niklas Tesch Filmproduktion,5,Preis Leistung passt.,N/A,"The processor does its job effortlessly. I haven't under- or overvolted it so far, because I'm completely satisfied with the performance."
Andrew Thomas,5,Great CPU,N/A,"Great performance, easy installation and worked straight out of the box.Intel is the real thing. Avoid imitators."
Lander G.,5,Perfecto,N/A,Great and at the best price
Cliente Amazon,5,Processore,N/A,Great 
Miguel Pedraza,5,Buen procesador,N/A,"Good processor, you can do whatever you want with it. The seller is regular, so he does not apply support on the sale, but hey, the important thing is the product. Recommended for video editing and gaming."
Un renard,5,Le CPU qui allie le plaisir des jeux et le s√©rieux des pros !,N/A,The Core i7-13700KF is the ideal©processor for building a gaming PC or performing professional tasks in the creative©fields. Note that this only works with a graphics card 
ROCK SEO,5,"This is the fastest CPU i've ever had, it crushes every task, unbelievable power. Get it.",N/A,"This is the fastest CPU i've ever had, it crushes every task, unbelievable power. Get this and don't think twice. Totally worth the money. It can also be energy efficient if you want, especially under Win11 out of the box. I went with Win10 in the end as i don't like 11.I coupled it with a fast SSD Samsung 990 Pro and a Liquid cooled solution a DeepCool LT 720, temps are always in the 35C and high 60-70C. Amazing.It will destroy any task. Overclocked to 5.5 GHZ it's a beast, i reckon it can even go higher."
Salvino,5,Ottimo,N/A,A monster of excellent power
J. Watts,5,Great upgrade,N/A,Even better than my 10700k . Good temps too considering at 5.3ghz with noctua cooler.
Guillaume Nk,5,"Montage vid√©o, Gaming, Montage photo, Design, un i7 √† tout faire !",N/A,perfect
routhier,5,Tourne comme une horloge,N/A,"I7 which runs like clockwork, I advise a good cooling because it tends to rise© in temperature©I put a watercooling 3 fan and nickel"
KANO,5,Nickel,N/A,great
Josiane magenta,5,Intel¬Æ Core‚Ñ¢ i7-13700KF,N/A,good one
Greg89,5,CPU  I7-13700KF,N/A,"The media could not be loaded.
                



I7-13700KF un processore con prestazioni elevate io personalmente lo sto utilizzando per il gaming, scalda abbastanza quando viene utilizzato su alte % quindi assicuratevi di associarlo ad un buon dissipatore io personalmente consiglio un liquid all-in-one, utilizzato con ram ddr5 da 32 gb 6400mhz di frequenza ha una velocit√† non da poco sopratutto quando andiamo installare grossi programmi e o giochi, li installo davvero in pochi minuti, KF sta a significare che √® overclockabile K e senza grafica integrata F che per il gaming va pi√π che bene dal momento che non si fa gaming senza scheda grafica, se desiderate un pc di fascia alta e non volete puntare ad un i9 che probabilmente non sfrutterete mai questo pu√≤ essere il giusto compromesso. non mi dilungo a spiegare le caratteristiche sono facilmente reperibili online. prodotto arrivato nei tempi descritti, Consigliato!"
Twitch origine1,5,Impeccable,N/A,best performance
Sevil Saykan,5,Schein Top zu sein :-),N/A,It was there quickly and was also quickly installed and it works :-)
D,5,I7 13700kf,N/A,"Very good, I'm very happy with itt"
Amazon Kunde,5,Top,N/A,everything is great 
Amazon Kunde,5,Super,N/A,Super
alessandro,5,Ottimo processore,N/A,"The processor is also great for those who don't want to overclock. For those who are not very familiar with processor nomenclatures, the f indicates that the processor does not have an integrated video card, not a big problem if you use a separate card. Excluding this particular the kf and k processor have the same performance, just look at the benchmark results."
Jasmin van Schrick,5,Top CPU,N/A,great 
Osy,5,Chauffe mais tr√®s performant,N/A,Incredible processor
Xenom,5,Intel 13700KF au top !,N/A,Gaming processor par excellence
chris,5,Puissance et stabilit√©,N/A,Nothing particular to say except that:- Powerful- Stable- Doesn't heat up too much about 50∞ in game with a pure rock 2.
Andrea V.,5,Intel 13700kf,N/A,Product arrived in perfect condition and ahead of delivery time
RBL77,5,Monstruo,N/A,It will take time until we see the need to update components and there is a difference to compete with this monster.
Vick,5,Excellent,N/A,Powerful and stable
Sidney L.,5,Super matos,N/A,An excellent compromise when you are looking for power without overkill with an I9  game dev!
Moritz S.,5,Toller Prozessor f√ºr Gaming,N/A,So far no problems and sufficient performance.
Lucindo Montrond,5,O PROCESSADOR √â DE EXCELENTE QUALIDADE,N/A,I LIKED EVERYTHING BECAUSE THE PRODUCT MEETS ALL MY MOST OPTIMISTIC EXPECTATIONS.
Tomasini jean-baptiste,5,Au top,N/A,no dissPOINTMENTS
JJavier98,5,Una maravilla,N/A,So far no complaints. A piece of CPU bug
moni22,5,Potente e versatile,N/A,I bought this cpu to upgrade my pc (from a 7600k I5) and I have to say that the difference can be felt. I have a 3080 Rtx and thanks to the greater power of the cpu the fps have increased significantly.
Mia,5,Sehr Starker Prozessor,N/A,"What can you complain about, runs great!! BUT 250 W in benchmarks, best to throttle to 125w in the biosIn gaming around the 90wGood AIO recommended (360mm minimum)"
Ana Sousa,5,powerful,N/A,amazing and powerful
david,5,Processeur i7 13700 KF,N/A,"It's a very good processor, heats up a lot if you put it at 5, 4 m„©gahertz but once blocked© at 5 by the BIOS it doesn't heat up at all the temperatures"
Paul,5,Nice cpu,N/A,Paired with b660. It works? Good cpu if you want intel.
Mario,5,Tanta potenza e consuma poco ma‚Ä¶,N/A,To be used to the fullest you need z690 motherboards etc.
LudoVII,5,Potenza fuori portata,N/A,Taken at a discount is a great deal
Aron Sturke,5,Leistung ohne Ende,N/A,perfect product
Amazon Kunde,5,Gaming Pur.,N/A,"Not only gaming is fun, also benchmarks with the CPU tell you that you are a 1 percent :)"
Fortnite89,5,Una bella Bombetta,N/A,"Excellent CPU performing, quick I recommend the ôpurchase."
MarcoX,5,Le Top du Top,N/A,excellent
Bruno,5,Produit conforme livraison rapide,N/A,Compliant product fast delivery and attractive©
Fabio,5,Ottima CPU!,N/A,"Excellent CPU, really performing even in ddr4, it does not heat up as you read 100% recommended!"
Vivien Rosing,5,Top Produkt,N/A,"Super arrived and well packaged. In addition, the processor works great and thanks to the vibrating architecture simply a perfect complement in my  pc"
Marco,5,Processore senza compromessi,N/A,"Coupled with a good gpu is a processor that can last years and years,"
Fabrizio,5,Perfetto,N/A,Great product
Autoservizi Trinacria,5,Top quality,N/A,Perfect
FloncH,5,Por ahora perfecto,N/A,"For now, the processor is performing everything the manufacturer says"
L&S,5,I7 13900KF,N/A,Juste incroyable rien a dire de plus
artyz,5,Tr√®s performant,N/A,"Very efficient processor in gaming,"
Andrii Sobol,5,"Good product, great quality.",N/A,"Good product, great quality."
Baudspleen,5,Altamente performante,N/A,"Latest generation, very high performance."
Sergio,5,CPU Intel Core i7-13700KF,N/A,Very good processor 
Zolito,5,Super,N/A,"Very happy, perfect delivery"
brijane,5,Tr√®s bien,N/A,Gift the person is very satisfied
This processor is absolutely incredible with no doubt's..But if you guys are thinking buy this one then I suggest please go for 360 AIO‚Ä¶,5,"5.0 out of 5 stars
Go for it..",N/A,This processor is absolutely incredible with no doubt‚Äôs‚Ä¶ The only this you have to keep in mind that go for atleast 360 AIO for more better performance‚Ä¶
yogesh Kumar,5,"5.0 out of 5 stars
Best cpu at this price bracket",N/A,"great
                



Most powerful cpu at this price bracket no doubt. Amazing performance.love it"
Dhruv Joshi,5,"5.0 out of 5 stars
Just bought it! and working great except the temperatures!!!",N/A,This is my best buy so far for gaming and editing. It runs great whatever you throw. Excellent performance so far. Cinebench score is 29000 at 125 TDP.Suggestion: Buy only if you have very good amount of cooler.
Robert Johnson,5,Super Fast and temperatures aren't as bad as I expected,N/A,"I bought this to replace my 10850k after I realized how much it was holding back my 4090.  I bought an ASRock z790 PG lightning /d4 board to go with it so I could use my existing DDR4 ram.  The difference was night and day!  I have an ID-Cooling 280mm AIO (cheapest I could find on Amazon) with a contact frame and kyronaut thermal grizzly extreme paste and does not thermal throttle on Cinebench R23 unless I run 3 or 4 passes back to back.  I am thrilled with how well this CPU runs.I was able to bump my DDR4 up to 4200mhz in gear 1 (timings cl20/26/26/26/48) after a bios update from ASRock and this thing is rock solid and crazy fast!  I get an average of 30500 in cinebench r23 and it will overclock as far as you want - I have taken it to 5.7 and it runs fine, it just thermal throttles quickly at that speed.  I'm pretty sure I could overclock this beast to the moon if I threw a lot more money into a custom cooling loop, but it is plenty fast as is.  I have no regrets about not bumping up to the 13900k, I do gaming and code compiling and it is a dream for both of those workloads."
Karl K.,5,Fastest Intel CPU without serious issues.,N/A,"Upgraded to the 13700k from the 11900k and the jump in performance was nothing short of massive. This 13th gen i7 K is officially Intel's fourth fastest CPU on paper but in real life it's the fastest of them all in terms of stability as the the three slated above it (13900k,14700k and 14900k) are all plagued with issues that Intel won't discuss but admits to, albeit grudgingly. Until a fix-all patch is released, the 13700k is the best choice for gamers and content creators who won't be bothered with unpredictable bugs and BSOD fests. What good is it having a Ferrari but with an engine that's goes offline 20 times a day?  May as well go with a Porsche that works. At that level of performance these high-end CPU's more or less all perform equal (or would if they all worked properly), but it's easy to understand the frustration of owners whose 30-day window for return to Amazon is closed."
Mar√≠a,5,Muy buena marca,N/A,Very good brand
Cliente de Amazon,5,Genial procesador,N/A,very good processor 
Ibrahim Erdem IRKICATAL,5,Good cpu,N/A,Might be overkill for most builds since i5 13600k is a very good choice as well.
Bom de mais,5,Muito bom,N/A,This is the best processor
Gabriel Lucas da Silva,5,Very powerful,N/A,"Playing valorant with competitive settings, average 99% fps is 400+"
Filipe,5,Excelente,N/A,"Troquei um Core i7 11700 por ele e senti diferen√ßa no desempenho, mesmo usando mem√≥ria ram ddr4."
