Name,Stars,Title,Date,Description
Randall,2,Very unreliable processor,N/A,"Since I bought this processor, I have had nothing but trouble. I wish I'd just returned it, but I had rose-tinted glasses. It couldn't be Intel's fault, I mean, I've had dozens of intel CPUs over the years, and never had a problem. But this thing....How do I know IT is the problem? When I set CPU affinity in Task Manager and limit the number of cores software has access to, everything runs fine. Slicing, games, my frigging web browser even!But if I unlock those applications and go 'all cores', stuf crashes left and right, the CPU bluescreens regularly, simple things like comfyUI crash the browser just by clicking on a node. HellDivers 2 can only be played between 2 and 10 minutes without crashing. All bets are off if I have 4 players.Just avoid this model. Get a different one or wait for the next iterationl."
Dan,2,MUST have good watercooling -- Too Hot,N/A,"I tried this CPU with and without a motherboard contact heat sink + Corsair H100x RGB Elite Liquid CPU.Although baseline is about 33C on HWINFO, when using Cinebench -- it eventually starts thermal throttling after starting at 85CPeaks at over 360W, for just the CPU -- so this CPU needs a professional cooler, as the two fan cooler was working but just couldn't keep up with how insanely hot this thing runs.I tried using everything, from different thermal pastes and liquid metal -- all of which failed.Most people probably buy this CPU and have no idea that it's beeing throttled during benchmarking.I was sadened by all the posts on redit mentioning to undervolt or turn off multicore optimization, lol...Great CPU if you don't care about electricity and have a great cooler."
M.C,2,Faulty product,N/A,It's not Amazon's issue but the processor I bought is faulty. I'm experiencing crashes while playing games. It's so annoying and so time-consuming. I had so many stressful moments because of this.
Bushcrafter1984,2,Heat issues with this 13900k,N/A,"Took me forever to figure this out, but I can't reach rated speeds on my 13900k due to throttling.SP 111/88 = 103Cooling: 170When the throttle happens, both P-cores and E-cores drop, causing performance hits in normal tasks as well as games. ASUS motherboard at default settings attempts to send extreme amounts of voltage to the CPU (1.4+) in order to reach boost rating (no XMP).This has literally been the most difficult processor to reign in heat I've had to deal with in my 30 years of computing, AMD is starting to look good I guess (which is why I switched to and have remained with intel for 20 years, AMD ran hot back in the day). Apparently even the 14900k's are having issues.It's power hungryIt's hotNot enough surface area to cool appropriately without risking your warrantyLiterally every solution I've seen involves doing things Intel recommends against.Intel: Some help would be appreciated."
Bradley Hart,2,Nothing But Issues,N/A,"I've had nothing but issues with this processor. It's a personal heater, causes tons of crashes, and can even blue screen from time to time. I've installed many processors and built plenty of PCs and i've never had any issues. For whatever reason i've had and heard of a lot of issues with the 13th gen. I hope this is only me and a select few rather than the product just being bad. I've always been an Intel and Nvidia user so trust me when I say I really wanted this to live up to the great reviews.Wouldn't recommend using this unless you have a good 360mm AIO."
Sean Bowl Fan,2,Do not get this chip unless you are a data Scientist or something,N/A,"This chip has cooling issues in gaming. Full stop. Really you should be looking at AMD X3D chips if you want the god chips, and if you want to stick with intel for reliability, the i5 does not bottleneck the 4090. If your cooling is TOP NOTCH, you will bottleneck a powerful graphics card via throttling. If you want a lot of coresfor some reason though, its pretty cool."
Cina Galloni,2,Overpriced,N/A,"Performance leaves much to be desired at this price point. Fastest gaming CPU on the planet when I bought it (other than their special edition), but when you‚Äôre paying this much it better predict my every move and leave me with no processing time. Truly absolutely ludicrous pricing, same unreasonable pricing as NVIDIA. Buy a different intel CPU at half the price for a 5-10% performance difference instead. Same chips, different manufacturing luck."
albert,2,Overpriced,N/A,Overpriced
Rip,3,Smokin‚Äô Hot and Not in a Good Way,N/A,Very fast CP.if you can keep it from throttling. Requires at leadt a 360mm AIO to even attempt to cool this thing. Pretty sure even the best air cooler would be overwhelmed. Intel needs to control their power draw and heat. It ois becoming an issue with their high end chips. It‚Äôs also way overpriced for what you get.
Doomsauce,3,Beware the poor quality control.,N/A,"This is an amazing processor, however I went through two defective, factory new, 13900KFs before I got one that actually worked. The errors from the defective chips ranged from flat-out not working to symptoms that resembled defective memory(which it wasn't as I had 3 sets of ram and 4 seperate M.2's to test).Roll your dice and hope you get a good one. Intel RMA took about 3 weeks per defective processor."
Cranky Customer,3,Good CPU!,N/A,"Liked everything about this item except for the packaging.  The CPU was inside the plastic protector but not secured inside the Intel branded box that the manufacturer placed it into.  When I received the package it made a sound like marbles dropping onto a glass top table!  I thought it was the end of the line for the CPU inside.  Wanted to send it back, but thought ahhhh, just give it a chance.  I did and it works fine.  I did take 2 stars for the lack of a decent packaging job by Intel.  For these prices, we are paying for better!"
ludax,3,Too hot,N/A,Even with a strong water cooling
Srimanth,3,"3.0 out of 5 stars
It can be more efficient I guess",N/A,"It is working almost same as my 10 yr old DELL XPS laptop, swapped with a SATA SSD, and i7 second gen processor. I don't know whats improved. But it's doing its job I guess.. in my 2 weeks of usage I have seen it's temprature rised above 80¬∞C once. Wasn't expecting that from current refined and powerful generations. I am using liquid cooling on top of this. And yet it hit 80¬∞C. What I was doing when that happened was trying to open a game. And one thing that I missed was to disable the integrated graphics because I have dedicated GPU. It was just for a moment the CPU was used during the game launch and after it started using the GPU. But until that switch happened, under less than a minute of CPU usage, it reached to 80¬∞c. I mean since these are premium products, there should be some protection layers blocking such usages, and close the programs instead rather than hitting its performance.But anyways, I disabled the integrated device and then it's all smooth. Everything normal except for that one instance explained above. Parallel processing is still shitty though with Windows OS. Same kind of processors on Mac before Apple silicon came in were working more efficiently. So I guess it's prob with windows OS, but not processors."
Papu82,3,"colis  d√©chir√© ,on croirait que l'on a cherch√© √† voir l'interieur",N/A, it looks like we have tried© to see the inside.we will see in the assembly
Carlos Canales,3,"Amazing processor, but check your CPU power management in BIOS",N/A,"So, first thing's first. This is a genuinely powerful CPU that's been able to handle basically every task that I've thrown at it. It runs demanding tasks like encoding and gaming with ease.Now with that out of the way; Thermals. This thing gets hot, and I mean REALLY hot. If you're going with air cooling I strongly recommend a double tower, six/eight pipe Air cooler like the Corsair A115 or a Cooler Master MA824. If you are going the AIO route, anything LESS than a 360mm AIO will under perform. For that, go with any 360mm AIO from any brand of your choice. If you have the space, go with a 420mm AIO for the best results.Finally, there has been recent reports of CPU degradation and instability when using this CPU. I am using this with an asus ROG STRIX Z790-H motherboard and it basically JUICED the CPU like no tomorrow until I applied intel's Power settings for this CPU. This likely is the cause of the degradation. Be sure to check intel's website for recommended power settings. Also check your motherboard vendor for any bios updates as Intel has confirmed that many motherboard vendors are running the i9 13900k CPU out of intel's specifications.In conclusion here's my personal experience: The CPU functions, but I can not use Asus' AI Overclocking feature as I get a BSOD with the CLOCK_WATCHDOG_TIMEOUT error and apps will randomly crash. You probably shouldn't use any AI assisted overclocking feature if you can help it. Even running this at stock, there is still a substantial amount of performance in this CPU. If you have an older rig and are looking to upgrade your CPU, I would just wait for Meteorlake or just go with AMD.Final note: I am not using a contact frame on my motherboard for my CPU."
IndyToronto,3,Surprisingly Fast but watch out for corner chip escapes,N/A,"We set up multiple computing servers to run heavy video processing algorithms essentially continuously everyday - to make a long story short, we liked how fast this ran compared to the i7-11th gen we had from before.The surprising thing is one day among 8 essentially identical machines, we noticed one desktop that seemed much hotter than the others.  We hooked up measurement of power draw and temperature readings of the CPUs and was shocked that this one was drawing 450W as others were showing < 200W.  And temperature went up to 100C while the others were at 70C.One system had a glitch where if you ran python and import numpy, it would reboot.  We determined the problem was that PSU only supported +12V rail at 20A.  We switched to a 600W PSU that supports +12V @50A and it worked flawlessly.  So watch out that your PSU supplies sufficient amps at +12V.Ordered a replacement, replacement brand new would not boot up.  We swapped back old CPU from, and it boots up but runs hot again.  This one we had to reduce workload to 75% of other systems to cool it down.So 2 out of 10 desktops are defective  This is a huge surprise.  These systems had no GPU, only motherboard, 64GB of DDR5, and an SSD.  Has anyone else seen this?"
Eddy and Amelia,3,Firsr chip was a factory defect.,N/A,Built my new pc. Thermals on the chip were high. Over 100¬∞c when benchmarking.Kept shutting down the system.Trouble shot my mobo/aio/bios for a couple days.Rralized it was a hot chip or a bad heat sensor in it.Got the new one today. 81¬∞c  uder full load.Never know what ur gunna get.Now i get to wait 30 days for my money back.At least its sorted.
Alex,3,Keep a fire extinguisher,N/A,"""911 whats your emergency?"" ""My cpu caught my house on fire"""
Caleb Jackson,3,Ordered new but received open and used,N/A,Received CPU opened and used.
I R ALGAR,4,thank you its great,N/A,thank you its great
elviscera,4,Fast but runs very hot,N/A,"Concerning Intel Core i9-13900KF,I have this CPU with board ASUS ROG Strix Z790-E Gaming WiFi 6E LGA 1700 for gaming usage.  Once I discovered that I had to slow the memory down from the 6600MHz XMP rating to 6200MHz, the board/cpu combo has worked very reliably  (multiple passes of OCCT Gold stress test).  Just checking the XMP II box,  the 6200MHz box and the (so called) AI overclocking box in the bios gives a score of 40K on Cinebench R23 so it's plenty fast -- the loss of 400MHz memory bandwidth isn't a big deal.  I tried various other adjustments but the latter turned out to be sufficiently fast and very reliable.  My current chip has a Silicon Predictor(SP) of 99 (roll of the dice).  I suspect that higher SP levels while possible are rare.I am using a ARCTIC Liquid Freezer II 360  AIO which works OK but the CPU can run hot.  The mother board cooling prediction for said AIO is 155 but that is not really enough for this chip to run all out.  It is easy to get this CPU up to 100C using OCT Power Stress test.  While the CPU might run at 100C for a long time, it will not do it any good and it will not run reliably -- I needed to check the 90C max box in the bios to get it to pass the OCCT power stress test.  I have a RTX 4090 and in the OCCT power test the net system power gets up to 1100W.  Normal gaming so far never gets to such power levels but still worth considering.FWIW, I have had a CPU apparently fail from running the OCCT Power Stress test.  If you want to run this CPU all out with reasonable temps, you really need significant cooling.  I doubt any AIO will work for this.  I suggest an open loop system with something like a Watercool MO-RA3 420 PRO radiator.All said, If you are building a gaming system, you would be just as well served with a ASUS ROG Strix Z690-E and a i9-12900KF CPU.  It will be easier to cool and will save you some money for a better graphics card which will make *much* more difference in most games than the CPU."
John M. Macros,4,Faster than expected,N/A,"Havent used intel in a long time, glad I went with it and an aio cooler"
Jos√© Luis Ballesteros,4,F√ÅCIL DE INSTALAR,N/A,okay product
Rob,4,Fast but runs hot,N/A,"This CPU is extremely fast but it gets hot under load. Even with my Thermaltake Toughliquid AIO360 it still reached 90 degrees while playing Cyberpunk on ultra settings. While it‚Äôs considered safe up to 100 degrees, I‚Äôm not comfortable with that much heat. May end up building a custom loop for better cooling."
Gary M.,4,This Puppy Runs HOT,N/A,"Got it attached to a 360 radiator, able to cool it perfectly -- But after around 10 minutes of gaming, my room turns into a sauna!"
Bheku,4,"Works, but with needed system configuration",N/A,"I initially got a 13700K, but grabbed this after and snubbed the 14 gen. I upgraded from 8700K, ***which is still a very capable cpu even today, but due to the demands of certain programs the 13900K is handling them better than the 13700K so far.Fingers crossed to hoping it will not fail in future. There are well documented power issues that Intel and their partners have with the 13th, 14th gen. May be an upsell to the upcoming ultra line of cpus?So you have to take this into account and modify your motherboards bios, and follow Intel's suggested settings.I will update this review if anything come up."
David W. Knight,4,Gaming,N/A,"Got it for my gaming machine, but all my games crashed when trying to play."
Oscar Burga,4,"Great processor, but failed quickly",N/A,"This CPU unit is a beast, upgraded from a i7 8700k...the improvement was HUGE. Doubled my FPS in WoW, and there is no more lag! Nevertheless, after 6 months of regular use, it started failing...many kernel errors until it finally became useless. I could, somehow, return it to INTEL (from Per√∫ to USA). Great support outside US...but such a complex and expensive unit cannot fail that quickly without heavy usage, at least in my opinion."
Prodigy,4,"Great CPU, go with an i5 or i7 if just gaming though",N/A,"Using Phantek Glacier D30 360mm cooler, during heavy stress load it gets around 82-84C. Just gaming in heavy modded Skyrim, FFXIV, and Total Warhammer 3 stays around 50-55C.Those complaining about temps higher than that while just gaming likely do not have their cooler mounted properly or too low end of a cooler.Make sure coolers plastic film is removed from metal block if it has that, apply plenty of thermal paste if cooler doesnt come pre applied with any, and evenly screw on the mounting screws to keep pressure as evenly as possible till all are set."
Lyd S.,4,"So far, so good",N/A,"This was bought for my son's custom build gaming  computer.Only a few weeks in, but I haven't heard any complaints from him."
Daniel Zuniga,4,Recommend Extreme Caution,N/A,"This thing puts enough heat out to power a thermal generator, and I really am not kidding. Water cooling ONLY unless you want to melt your board or destroy the high dollar part. I would also recommend a large radiator too, 3 fan coverage. This thing is an excellent space heater.Outclasses thread ripper by almost double its paces per benchmarking in multicore. Handles everything I throw at it then yawns at me as if it was boring and mediocre work.Simply put, leader of the pack right now and handles literally anything I‚Äôve tried to hit it with, even running multiple games at once (when combined with a good GPU, naturally).I have zero complaints. I‚Äôve learned to hate a lot of intel items over the years, but this truly is a marvel."
Wahub,4,it's pretty Good but not enough power for RTX 4090 & 4080,N/A,"It comes with CPU only in a box & without a Fan, so you need to buy an LGA1700 Fan Support, it running Quit Good, but not the Greatest yet for RTX 4090, 4080, because the GPU usage will reach 95-98, it doesn't go %99 all the times so there's a bit of CPU bottleneck even at 4K Resolution & it gets even worst CPU bottleneck in 1440p or 1080p, so i think the Core i9-14900K or 15900K will get the job done no CPU bottleneck, i used this with ASUS ROG Strix Z790-F Gaming DDR5 it works great!Thanks to the seller is Trusted!"
Snowstorm,4,Too hot,N/A,This processor produces too much heat. Forget obout overclocking (I tried Intel utility). In overclocked mode the processor consumes over 300W and heats to over 100C even with the best cooler. Without overclocking it consumes about 250W and heats up to 89C under the full load (which is acceptable).
Gabriel,5,I9,N/A,Excelente 
Maicor Hern√°ndez,5,Exelente,N/A,I received what I bought in a timely manner
Zachary Stevens,5,Performance and consistency King,N/A,"If you value the best gaming performance, workstation, content creation and overall consistency in performance. The I9 13900k is the best consumer CPU on the market. Paired with a Z790 motherboard, while tuned and with very fast DDR5 ram. The I9 13900k is significantly faster than AMD‚Äôs Ryzen 9 7950x in gaming and consistently faster in most workstation applications. If you want the best this is it."
michelle r.,5,It's is a BEAST,N/A,It is the single fastest processor in the world and it is great for it's price! It's 24 cores are a little disappointing because 16 of the 24 cores are efficiency cores leaving 8 cores to be the more powerful performance cores. The processor is unlocked and it can reach 5.8GHz! It is absolutely crazy! It is 100% worth it but make sure you have an AIO to keep it cool.
Carlos,5,One of the most powerful processors in the market!,N/A,Would recommend it for your battle station. I could not be happier.
LeonZombie,5,Amazing for everything.,N/A,You want quality? You pay for quality. You get quality with this cpu.
Natasha,5,Will not need a upgrade for a couple of years,N/A,Amazing. Really happy with the performance. Won't need to upgrade for a few years
CRAIG DUFFY,5,Nothing but the best,N/A,Super speed great quality üëå
thebutlersebas,5,the shear power that i weld is amazing,N/A,i like the shear process that i can do with my work and gaming and vr gamesthe only thing that i dislike is about is the price that's it
Hayes,5,100% right out of the box,N/A,Perfect right out of the box. Nice packaging 13900 is a beast. Running on 1350W PSU with water cooling sitting at 38c under load.
emmanuel,5,Perfect,N/A,No issue.work well handle all task with ease. Smooth and stay cool with √† big noctua dh15 at 46degree
Vantha S.,5,Great CPU,N/A,Fast
Nick B,5,Insane performance,N/A,"Cinebench R23 scores: 40,345 MT / 2,284 STUpgrading from the Ryzen 5950X, this processor has some significant uplift, particularly in the single-core speed. Minimal overclocking headroom as Intel has already milked 90% of the performance on stock settings. However, with some tweaking, you're likely to get up to 6.2 Ghz boost behavior for single-core loads, and bump up the all-core boost to 5.7 Ghz (up from 5.5 Ghz stock). With some further tweaking of the voltage-frequency curve, you could probably tweak this even further. I'm not a big fan of all-core overclocks on these type of processors, as you will lose the boosting single-core speed. In my opinion, this processor shines for gaming because of its single-core boosting performance.Memory controller has been significantly improved over Alder Lake. I was easily able to get my DDR5 6400 XMP profile running without any tweaking. I'm pretty sure this can be easily pushed further, but it seems like around 6400 Mhz memory is the roughly the sweet spot in terms of price vs performance.Very power hungry, but despite the bad reputation from reviewers, the power consumption can be easily tamed. If you run power limits unlocked, you will likely be thermal limited due to thermal throttling at 100c. However, you don't need unlocked power limits - you're talking about a very small 5-10% performance uplift but using >100W more power to achieve this. I would suggest running it at stock power limits, or unlocked power limits but seriously consider undervolting.On a final note, I wouldn't consider getting the rumored 6.0 Ghz version of the 13900K in the future. The current 13900K can easily be pushed to >6 Ghz boost speeds and will save you money."
s,5,good . temp issues are overblownw,N/A,"i upgraded from 5900xt. I got the msi board z690 -a for 159, and this the 13900kf. I ‚Äòve been wanting a cpu with an IGPU for years, but couldn‚Äôt justify the price increase on the gpu version. I actually use a dgpu but it really is convenient, and they can be used to accelerate some work. Again, before you judge i'm using this for work, productivity. NOT gaming. I would spend 200 for a gaming cpu.my use case is productivity. i‚Äôm a developer, and this is the sole reason i upgraded. I was fighting windows freezing and slowing down during a lot of my workflows. I use wsl intellj, docker, react apps java etc, often at the same time. It‚Äôs pretty noticeable the improvement. It really helped.  Like that i could use ddr4 for now since the boards are about 150 it was acceptable.Heat: The cpu gets a bad reputation due to heat and wattage. I put this in the bucket frankly that amd got as well. I mean it‚Äôs fine they are using as much power as needed to maximize perf. I limited the cpu to 250w, and it runs on a d15 cooler than my 5900, Full load can get up to high 80c, but working is 30‚Äôs. you lose very little perf by running it more in the zone. I don't know about other boards but that msi one sure makes it easy and the price if right.About the cpu: it has a ton of cores, I didn't need to buy ddr5--  i need quite a lot of ram and it still costs too much for the benefit it provides in my workload. The memory controller on 13gen is far better than ryzen 5000 series. I couldn't before get my ddr4 stable at 4000 on the 5900x and it did it on the intel one immediately. Indeed i was even able to tighten up the timings just a touch. So modern processors (and i'd assume the amd ones as well) have made welcome improvements to memory support. Id' say if you don't need as much ram say 32gb, and you don't have ddr4 already to tide you over i'd consider getting ddr5 though.  I mean nothing is cheaper than what you have and 4k speed is fine. If i had nothing or maybe some old ram i'd go w/ ddr5.Price: For 570 it‚Äôs decent deal here. It is more than i love spending, but for what you get it is a lot better than what amd is offering at the time i write this which was 700.I do wish intel supported board reuse down the line, but that even can. be overblown (to an extent, and only an extent) though it's a selling feature to me frankly reuse!! I had to really think about that. I don't understand why intel is so stubborn on this subject.  with my amd cpu i went from 2700x to 5900x and the board went from a 470 to 570 because i waned more io and better pcie but i also gave that board to my kid and upgraded it one time. With intel especially I mean i just buy cheap boards anyway and upgrade more because there are a ton of features that get added half the time. I usually try to spend about 150 on a board, though it. is getting harder but it would be more my preference. I 'm not really onboard with the 600 motherboards. Is there a  300 one in-between i guess so but that's equally unappealing to me esp w/ out the upgrade.Tips/A rant if you will: trust me on this that msi board for 159 is so amazing. It really works great. don‚Äôt worry about the vrm. that‚Äôs also very overblown too. you can go calculate the amperage this will not come close. ALso msi is a great brand and the bios is easy to navigate. If you want fancy audio buy a dac that you can reuse and plug into usb and keep reusing it. Just think about what you really need in there. The msi board has a nice selection of pcie slots and well placed nvme. I use multiple gpu one nvidia gpu quatro for encoding (its a small one) and and amd one 6900 i bought for 570 for gaming. I just really love the layout connectivity and features of the board. They cut all the stuff i don't need and pared with the cpu it's all together about 700 for a cpu and board, pretty much as good as you can get."
Kevin,5,i9 13900kf,N/A,super avec intel tu trompe pas vous etre sa coche
NatureWhish,5,Super Produit !,N/A,"livraison rapide, produit a la hauteur des performances."
